<?xml version="1.0" encoding="UTF-8" ?>
<!DOCTYPE User SYSTEM "BaseFace.dtd">
<User>
    <UserID>1</UserID>
    <NickName>LikeTester</NickName>
    <Email>test@gmail.com</Email>
    <Password>test12345</Password>
    <FirstName>Alex</FirstName>
    <LastName>Smoke</LastName>
    <MiddleName>Cooks</MiddleName>
    <PhoneNumber>804456982365</PhoneNumber>
    <ChooseCar>
        <Car>
            <CarID>1</CarID>
            <SerialNumber>2g4bs4bf4r5bb</SerialNumber>
            <Brand>Mercedes</Brand>
            <Model>S-class</Model>
            <BodyCar>Coupe</BodyCar>
            <YearRelease>2017</YearRelease>
            <Color>Black</Color>
            <CreateReport>
                <Report>
                    <ReportID>1</ReportID>
                    <BrandAndModel>Mercedes S-class</BrandAndModel>
                    <DataOrder>11.04.2018</DataOrder>
                    <Commission summa="$">2</Commission>
                    <Cost summa="$">120000</Cost>
                    <TotalCost summa="$">12000</TotalCost>
                </Report>
            </CreateReport>
        </Car>
    </ChooseCar>
</User>